{
  "$schema": "https://json-schema.org/draft/2020-12/schema",
  "$id": "https://scout.local/schema/target_host_s5a1_execution_policy_v13.json",
  "type": "object",
  "additionalProperties": false,
  "required": ["schema_version", "document_type", "execution_id", "transfer_id", "parent_v12", "package_v9", "v13_contract", "preserved_v12", "tf_contract", "sandbox", "safety"],
  "properties": {
    "schema_version": {"const": "smpcc-r8-liquid-s5a1-execution-policy-v13"},
    "document_type": {"const": "SMPCC_R8_LIQUID_S5A1_EXECUTION_POLICY_V13"},
    "execution_id": {"const": "s5a1_primary_bsmooth_b01_20260812T000300Z_v13"},
    "transfer_id": {"const": "SIM-S1_CORE_H1_C1_Bsmooth_b01_r01_r8_liquid_handoff_v3_v9"},
    "parent_v12": {"$ref": "#/$defs/revision5"},
    "package_v9": {"$ref": "#/$defs/revision4"},
    "v13_contract": {"$ref": "#/$defs/revision4"},
    "preserved_v12": {"$ref": "#/$defs/preservedV12"},
    "tf_contract": {"$ref": "#/$defs/tfContract"},
    "sandbox": {"$ref": "#/$defs/sandbox"},
    "safety": {"$ref": "#/$defs/safety"}
  },
  "$defs": {
    "sha": {"type": "string", "pattern": "^[0-9a-f]{64}$"},
    "path": {"type": "string", "pattern": "^/[^\\u0000]*$"},
    "file": {"type": "object", "additionalProperties": false, "required": ["path", "sha256", "mode", "size_bytes"], "properties": {"path": {"$ref": "#/$defs/path"}, "sha256": {"$ref": "#/$defs/sha"}, "mode": {"type": "string", "pattern": "^[0-7]{4}$"}, "size_bytes": {"type": "integer", "minimum": 0}}},
    "revision4": {"type": "object", "additionalProperties": false, "required": ["policy", "schema", "gate", "tests"], "properties": {"policy": {"$ref": "#/$defs/file"}, "schema": {"$ref": "#/$defs/file"}, "gate": {"$ref": "#/$defs/file"}, "tests": {"$ref": "#/$defs/file"}}},
    "revision5": {"type": "object", "additionalProperties": false, "required": ["policy", "policy_schema", "receipt_schema", "supervisor", "tests"], "properties": {"policy": {"$ref": "#/$defs/file"}, "policy_schema": {"$ref": "#/$defs/file"}, "receipt_schema": {"$ref": "#/$defs/file"}, "supervisor": {"$ref": "#/$defs/file"}, "tests": {"$ref": "#/$defs/file"}}},
    "partialDir": {"type": "object", "additionalProperties": false, "required": ["path", "inode", "mode", "size_bytes", "nlink", "entry_count", "inventory_sha256"], "properties": {"path": {"const": "/home/zrj/scout_liquid_lab/incoming/SIM-S1_CORE_H1_C1_Bsmooth_b01_r01_r8_liquid_handoff_v3_v8.partial"}, "inode": {"const": 15748917}, "mode": {"const": "0700"}, "size_bytes": {"const": 4096}, "nlink": {"const": 2}, "entry_count": {"const": 20}, "inventory_sha256": {"const": "20939ba803430ff4bcd90123f6d884cd50f036557f167c4d424c612ea250ccca"}}},
    "preservedV12": {"type": "object", "additionalProperties": false, "required": ["partial_root", "final_root_absent", "receipt", "receipt_reservation_absent", "status", "failure", "return_code", "primary_bag_post_sha256", "real_bag_read_attempted", "real_bag_read_confirmed", "bwrap_run", "package_entries"], "properties": {"partial_root": {"$ref": "#/$defs/partialDir"}, "final_root_absent": {"const": true}, "receipt": {"$ref": "#/$defs/file"}, "receipt_reservation_absent": {"const": true}, "status": {"const": "S5A1_EXECUTION_FAILED_PRESERVED"}, "failure": {"const": "manifest policy parent.path differs"}, "return_code": {"const": 0}, "primary_bag_post_sha256": {"const": "c82c1f16b41bced51ab0aff63e4ef40b469501e185851344789fc3d62399fc07"}, "real_bag_read_attempted": {"const": true}, "real_bag_read_confirmed": {"const": true}, "bwrap_run": {"const": true}, "package_entries": {"const": 20}}},
    "diagnostic": {"type": "object", "additionalProperties": false, "required": ["absolute_maximum_position_delta_m", "maximum_time_delta_s", "absolute_maximum_angular_delta_rad", "relative_maximum_translation_delta_m", "relative_rms_translation_delta_m", "relative_maximum_angular_delta_rad"], "properties": {"absolute_maximum_position_delta_m": {"const": 3.9934499955863565}, "maximum_time_delta_s": {"const": 0.005}, "absolute_maximum_angular_delta_rad": {"const": 0.023228249162941604}, "relative_maximum_translation_delta_m": {"const": 0.03995630546880967}, "relative_rms_translation_delta_m": {"const": 0.022725548786785066}, "relative_maximum_angular_delta_rad": {"const": 0.003657518055773045}}},
    "tfContract": {"type": "object", "additionalProperties": false, "required": ["comparison_frame", "maximum_time_delta_s", "maximum_position_delta_m", "maximum_angular_delta_rad", "tf_used_as_motion", "real_diagnostic_witness"], "properties": {"comparison_frame": {"const": "T0_INVERSE_TIMES_T_RELATIVE_SE3"}, "maximum_time_delta_s": {"const": 0.5}, "maximum_position_delta_m": {"const": 0.05}, "maximum_angular_delta_rad": {"const": 0.1}, "tf_used_as_motion": {"const": false}, "real_diagnostic_witness": {"$ref": "#/$defs/diagnostic"}}},
    "environment": {"type": "object", "additionalProperties": false, "required": ["PATH", "HOME", "PYTHONDONTWRITEBYTECODE"], "properties": {"PATH": {"const": "/usr/bin"}, "HOME": {"const": "/nonexistent"}, "PYTHONDONTWRITEBYTECODE": {"const": "1"}}},
    "sandbox": {"type": "object", "additionalProperties": false, "required": ["canonical_argv_sha256", "canonical_token_count", "fd_placeholders", "child_environment", "host_environment", "uid", "gid", "mapped_groups", "writable_bind", "recursive_parent_policies", "generic_nonempty_parent_map_exclusions", "base_receipt_parent_coverage", "local_python_import_closure_count", "local_python_import_closure_sha256", "all_local_imports_ro_bound", "runtime_binding_guard", "runtime_binding_fields", "exact_raw_v1_origin_only"], "properties": {"canonical_argv_sha256": {"$ref": "#/$defs/sha"}, "canonical_token_count": {"type": "integer", "minimum": 1}, "fd_placeholders": {"const": ["@S5A0_RECEIPT_FD@", "@SOURCE_BAG_FD@"]}, "child_environment": {"$ref": "#/$defs/environment"}, "host_environment": {"$ref": "#/$defs/environment"}, "uid": {"const": 1000}, "gid": {"const": 1000}, "mapped_groups": {"const": [65534,65534,65534,65534,65534,65534,65534,65534,1000]}, "writable_bind": {"const": "/home/zrj/scout_liquid_lab/incoming/SIM-S1_CORE_H1_C1_Bsmooth_b01_r01_r8_liquid_handoff_v3_v9.partial"}, "recursive_parent_policies": {"const": ["v12", "v11", "v10", "v9"]}, "generic_nonempty_parent_map_exclusions": {"const": ["/home/zrj/scout_liquid_lab/audits/SIM-S1_CORE_H1_C1_Bsmooth_b01_r01_r8_liquid_handoff_v3_v4.execution_v8.json.partial", "/home/zrj/scout_liquid_lab/audits/SIM-S1_CORE_H1_C1_Bsmooth_b01_r01_r8_liquid_handoff_v3_v6.execution_v10.json.partial", "/home/zrj/scout_liquid_lab/audits/SIM-S1_CORE_H1_C1_Bsmooth_b01_r01_r8_liquid_handoff_v3_v7.execution_v11.json.partial"]}, "base_receipt_parent_coverage": {"const": true}, "local_python_import_closure_count": {"type": "integer", "minimum": 1}, "local_python_import_closure_sha256": {"$ref": "#/$defs/sha"}, "all_local_imports_ro_bound": {"const": true}, "runtime_binding_guard": {"const": true}, "runtime_binding_fields": {"const": ["SCRIPT", "POLICY", "PACKAGE_SCHEMA", "RECEIPT_SCHEMA", "GATE", "EXTRACTOR", "BRIDGE", "READER", "COMPAT_GATE", "TRANSFER_ID", "PARTIAL_ROOT", "FINAL_ROOT", "EXECUTION_RECEIPT", "EXECUTION_RECEIPT_PARTIAL", "S5A0_FINAL_RECEIPT", "S5A0_EVIDENCE_ROOT", "S5A0_INNER_RECEIPT", "EXPECTED", "gate", "extractor", "build_bwrap_argv", "load_package", "reserve_receipt", "publish_reserved_receipt", "mock_failure_receipt", "subprocess"]}, "exact_raw_v1_origin_only": {"const": true}}},
    "safety": {"type": "object", "additionalProperties": false, "required": ["optional_bag_read", "gpu_exposed", "solver_executed", "network_used", "sudo_used", "v8_evidence_preserved", "v10_evidence_preserved", "v11_evidence_preserved", "v12_evidence_preserved", "parent_publisher_used", "real_bag_read_attempted", "real_bag_read_confirmed", "bwrap_run"], "properties": {"optional_bag_read": {"const": false}, "gpu_exposed": {"const": false}, "solver_executed": {"const": false}, "network_used": {"const": false}, "sudo_used": {"const": false}, "v8_evidence_preserved": {"const": true}, "v10_evidence_preserved": {"const": true}, "v11_evidence_preserved": {"const": true}, "v12_evidence_preserved": {"const": true}, "parent_publisher_used": {"const": false}, "real_bag_read_attempted": {"const": "UNKNOWN"}, "real_bag_read_confirmed": {"const": "UNKNOWN"}, "bwrap_run": {"const": "UNKNOWN"}}}
  }
}
