{
  "schema_version": "smpcc-r8-liquid-s5a1-execution-policy-v13",
  "document_type": "SMPCC_R8_LIQUID_S5A1_EXECUTION_POLICY_V13",
  "execution_id": "s5a1_primary_bsmooth_b01_20260812T000300Z_v13",
  "transfer_id": "SIM-S1_CORE_H1_C1_Bsmooth_b01_r01_r8_liquid_handoff_v3_v9",
  "parent_v12": {
    "policy": {
      "path": "/home/zrj/scout_ws/src/scout_apps/simulation/scout_dualsphysics_liquid/config/target_hosts/liquid_zrj_msi_u2404_s5a1_execution_policy_v12.json",
      "sha256": "016d1cdbc00336d250d5293df5f8bd08b0eaf746bf7917f8c3635cca6ccb30b8",
      "mode": "0664",
      "size_bytes": 7364
    },
    "policy_schema": {
      "path": "/home/zrj/scout_ws/src/scout_apps/simulation/scout_dualsphysics_liquid/schema/target_host_s5a1_execution_policy_v12.json",
      "sha256": "782f105ec44fbe06d95580648d9ba8efda3a0a99f27fe68e01b3318475e50ea8",
      "mode": "0664",
      "size_bytes": 8038
    },
    "receipt_schema": {
      "path": "/home/zrj/scout_ws/src/scout_apps/simulation/scout_dualsphysics_liquid/schema/target_host_s5a1_execution_receipt_v12.json",
      "sha256": "273e21568a5bf5e813ac76aa463f60bb0a90f05aaf6b8eb533732c01de2a88a4",
      "mode": "0664",
      "size_bytes": 1713
    },
    "supervisor": {
      "path": "/home/zrj/scout_ws/src/scout_apps/simulation/scout_dualsphysics_liquid/scripts/r8_liquid_s5a1_execution_supervisor_v12.py",
      "sha256": "2aedcadaaabdfa5a0ef759b6e5e12e1d97c0011f268acae5a5e5e649637f80ce",
      "mode": "0664",
      "size_bytes": 34177
    },
    "tests": {
      "path": "/home/zrj/scout_ws/src/scout_apps/simulation/scout_dualsphysics_liquid/tests/test_s5a1_execution_supervisor_v12.py",
      "sha256": "58731e1e72cc39a1f1f1ece0cf53251b01ebb30a645beb7d4c605a797b923fd3",
      "mode": "0664",
      "size_bytes": 10235
    }
  },
  "package_v9": {
    "policy": {
      "path": "/home/zrj/scout_ws/src/scout_apps/simulation/scout_dualsphysics_liquid/config/target_hosts/liquid_zrj_msi_u2404_s5a1_primary_handoff_v3_v9.json",
      "sha256": "473da9da59f14f921ecb5acd61412f3e1620daebec238b02de70028faa31becf",
      "mode": "0664",
      "size_bytes": 820
    },
    "schema": {
      "path": "/home/zrj/scout_ws/src/scout_apps/simulation/scout_dualsphysics_liquid/schema/target_host_s5a1_handoff_package_v9.json",
      "sha256": "ba7c145c9453a8e082fe144b6cc4c77c0fb31e4f3eb4295f93a100452c3ea9d1",
      "mode": "0664",
      "size_bytes": 483
    },
    "gate": {
      "path": "/home/zrj/scout_ws/src/scout_apps/simulation/scout_dualsphysics_liquid/scripts/r8_liquid_s5a1_handoff_gate_v11.py",
      "sha256": "882afd6e9375b53012faa01937653bfa987cc04c4d185fa442edfc322667aa59",
      "mode": "0664",
      "size_bytes": 5755
    },
    "tests": {
      "path": "/home/zrj/scout_ws/src/scout_apps/simulation/scout_dualsphysics_liquid/tests/test_s5a1_handoff_gate_v11.py",
      "sha256": "9f5c5c4fcd19f0a112ee178fe421464114e65893f3ea3b4cf70c3a325a6bffea",
      "mode": "0664",
      "size_bytes": 2392
    }
  },
  "v13_contract": {
    "policy": {
      "path": "/home/zrj/scout_ws/src/scout_apps/simulation/scout_dualsphysics_liquid/schema/target_host_s5a1_execution_policy_v13.json",
      "sha256": "d9fc2f504e863376afaced4baca4fdd0be3e16153591fa19b27df1c0c6de4124",
      "mode": "0664",
      "size_bytes": 8359
    },
    "schema": {
      "path": "/home/zrj/scout_ws/src/scout_apps/simulation/scout_dualsphysics_liquid/schema/target_host_s5a1_execution_receipt_v13.json",
      "sha256": "696bee877054186a67ca0c9bade2b4bea16462da6fb3539f247e40b59dd82503",
      "mode": "0664",
      "size_bytes": 1713
    },
    "gate": {
      "path": "/home/zrj/scout_ws/src/scout_apps/simulation/scout_dualsphysics_liquid/scripts/r8_liquid_s5a1_execution_supervisor_v13.py",
      "sha256": "f1b37105b6c43c7578227de66c3fdb0160e0d15ce28ed0bf084ee0c2b4b894bd",
      "mode": "0664",
      "size_bytes": 42518
    },
    "tests": {
      "path": "/home/zrj/scout_ws/src/scout_apps/simulation/scout_dualsphysics_liquid/tests/test_s5a1_execution_supervisor_v13.py",
      "sha256": "3546a8ab7e13152c68fae40ac5c17f7d1ebce3e4b109fa0fa0e3db591dd504a4",
      "mode": "0664",
      "size_bytes": 11749
    }
  },
  "preserved_v12": {
    "partial_root": {
      "path": "/home/zrj/scout_liquid_lab/incoming/SIM-S1_CORE_H1_C1_Bsmooth_b01_r01_r8_liquid_handoff_v3_v8.partial",
      "inode": 15748917,
      "mode": "0700",
      "size_bytes": 4096,
      "nlink": 2,
      "entry_count": 20,
      "inventory_sha256": "20939ba803430ff4bcd90123f6d884cd50f036557f167c4d424c612ea250ccca"
    },
    "final_root_absent": true,
    "receipt": {
      "path": "/home/zrj/scout_liquid_lab/audits/SIM-S1_CORE_H1_C1_Bsmooth_b01_r01_r8_liquid_handoff_v3_v8.execution_v12.json",
      "sha256": "b91ea39194869e9b3363f9c7d83b2f54b2991df93a579b44570f3fdee7221d7a",
      "mode": "0440",
      "size_bytes": 28472
    },
    "receipt_reservation_absent": true,
    "status": "S5A1_EXECUTION_FAILED_PRESERVED",
    "failure": "manifest policy parent.path differs",
    "return_code": 0,
    "primary_bag_post_sha256": "c82c1f16b41bced51ab0aff63e4ef40b469501e185851344789fc3d62399fc07",
    "real_bag_read_attempted": true,
    "real_bag_read_confirmed": true,
    "bwrap_run": true,
    "package_entries": 20
  },
  "tf_contract": {
    "comparison_frame": "T0_INVERSE_TIMES_T_RELATIVE_SE3",
    "maximum_time_delta_s": 0.5,
    "maximum_position_delta_m": 0.05,
    "maximum_angular_delta_rad": 0.1,
    "tf_used_as_motion": false,
    "real_diagnostic_witness": {
      "absolute_maximum_position_delta_m": 3.9934499955863565,
      "maximum_time_delta_s": 0.005,
      "absolute_maximum_angular_delta_rad": 0.023228249162941604,
      "relative_maximum_translation_delta_m": 0.03995630546880967,
      "relative_rms_translation_delta_m": 0.022725548786785066,
      "relative_maximum_angular_delta_rad": 0.003657518055773045
    }
  },
  "sandbox": {
    "canonical_argv_sha256": "226ce2950d43b0f4b8f90ad564a0bdb9607ac387867d3ccb743e8c2adb7df32b",
    "canonical_token_count": 221,
    "fd_placeholders": [
      "@S5A0_RECEIPT_FD@",
      "@SOURCE_BAG_FD@"
    ],
    "child_environment": {
      "PATH": "/usr/bin",
      "HOME": "/nonexistent",
      "PYTHONDONTWRITEBYTECODE": "1"
    },
    "host_environment": {
      "PATH": "/usr/bin",
      "HOME": "/nonexistent",
      "PYTHONDONTWRITEBYTECODE": "1"
    },
    "uid": 1000,
    "gid": 1000,
    "mapped_groups": [
      65534,
      65534,
      65534,
      65534,
      65534,
      65534,
      65534,
      65534,
      1000
    ],
    "writable_bind": "/home/zrj/scout_liquid_lab/incoming/SIM-S1_CORE_H1_C1_Bsmooth_b01_r01_r8_liquid_handoff_v3_v9.partial",
    "recursive_parent_policies": [
      "v12",
      "v11",
      "v10",
      "v9"
    ],
    "generic_nonempty_parent_map_exclusions": [
      "/home/zrj/scout_liquid_lab/audits/SIM-S1_CORE_H1_C1_Bsmooth_b01_r01_r8_liquid_handoff_v3_v4.execution_v8.json.partial",
      "/home/zrj/scout_liquid_lab/audits/SIM-S1_CORE_H1_C1_Bsmooth_b01_r01_r8_liquid_handoff_v3_v6.execution_v10.json.partial",
      "/home/zrj/scout_liquid_lab/audits/SIM-S1_CORE_H1_C1_Bsmooth_b01_r01_r8_liquid_handoff_v3_v7.execution_v11.json.partial"
    ],
    "base_receipt_parent_coverage": true,
    "local_python_import_closure_count": 30,
    "local_python_import_closure_sha256": "41eb56d9c6f26dbed47756e5224c648835d44de570f6e4c11ebeb679d13cbdb6",
    "all_local_imports_ro_bound": true,
    "runtime_binding_guard": true,
    "runtime_binding_fields": [
      "SCRIPT",
      "POLICY",
      "PACKAGE_SCHEMA",
      "RECEIPT_SCHEMA",
      "GATE",
      "EXTRACTOR",
      "BRIDGE",
      "READER",
      "COMPAT_GATE",
      "TRANSFER_ID",
      "PARTIAL_ROOT",
      "FINAL_ROOT",
      "EXECUTION_RECEIPT",
      "EXECUTION_RECEIPT_PARTIAL",
      "S5A0_FINAL_RECEIPT",
      "S5A0_EVIDENCE_ROOT",
      "S5A0_INNER_RECEIPT",
      "EXPECTED",
      "gate",
      "extractor",
      "build_bwrap_argv",
      "load_package",
      "reserve_receipt",
      "publish_reserved_receipt",
      "mock_failure_receipt",
      "subprocess"
    ],
    "exact_raw_v1_origin_only": true
  },
  "safety": {
    "optional_bag_read": false,
    "gpu_exposed": false,
    "solver_executed": false,
    "network_used": false,
    "sudo_used": false,
    "v8_evidence_preserved": true,
    "v10_evidence_preserved": true,
    "v11_evidence_preserved": true,
    "v12_evidence_preserved": true,
    "parent_publisher_used": false,
    "real_bag_read_attempted": "UNKNOWN",
    "real_bag_read_confirmed": "UNKNOWN",
    "bwrap_run": "UNKNOWN"
  }
}
